{
  "__inputs": [
    {
      "name": "DS_LOKI",
      "label": "Loki",
      "description": "Loki datasource (e.g. grafanacloudloki)",
      "type": "datasource",
      "pluginId": "loki",
      "pluginName": "Loki"
    }
  ],
  "__elements": {},
  "__requires": [
    {
      "type": "grafana",
      "id": "grafana",
      "name": "Grafana",
      "version": "10.4.0"
    },
    {
      "type": "datasource",
      "id": "loki",
      "name": "Loki",
      "version": "1.0.0"
    },
    {
      "type": "panel",
      "id": "logs",
      "name": "Logs",
      "version": ""
    },
    {
      "type": "panel",
      "id": "table",
      "name": "Table",
      "version": ""
    },
    {
      "type": "panel",
      "id": "timeseries",
      "name": "Time series",
      "version": ""
    },
    {
      "type": "panel",
      "id": "row",
      "name": "Row",
      "version": ""
    }
  ],
  "annotations": {
    "list": [
      {
        "builtIn": 1,
        "datasource": {
          "type": "grafana",
          "uid": "-- Grafana --"
        },
        "enable": true,
        "hide": true,
        "iconColor": "rgba(0, 211, 255, 1)",
        "name": "Annotations & Alerts",
        "type": "dashboard"
      }
    ]
  },
  "description": "DraftForge structured-log dashboard. One auto-generated row per `system` (repeats via the $system template variable), each row containing log-rate, warn+error rate, and live tail filtered to that system. Backed by the project's structlog taxonomy — see docs/dev/telemetry/logging.md and .claude/skills/logging/SKILL.md.",
  "editable": true,
  "fiscalYearStartMonth": 0,
  "graphTooltip": 1,
  "id": null,
  "links": [],
  "panels": [
    {
      "collapsed": false,
      "gridPos": {
        "h": 1,
        "w": 24,
        "x": 0,
        "y": 0
      },
      "id": 100,
      "panels": [],
      "title": "Overview — all systems",
      "type": "row"
    },
    {
      "datasource": {
        "type": "loki",
        "uid": "${DS_LOKI}"
      },
      "description": "Every (system, subsystem) tuple seen in range. Surfaces newly-shipped subsystems and silently-dropped ones.",
      "fieldConfig": {
        "defaults": {
          "color": {
            "mode": "thresholds"
          },
          "custom": {
            "align": "auto",
            "cellOptions": {
              "type": "auto"
            },
            "inspect": false
          },
          "mappings": [],
          "thresholds": {
            "mode": "absolute",
            "steps": [
              {
                "color": "green",
                "value": null
              }
            ]
          }
        },
        "overrides": [
          {
            "matcher": {
              "id": "byName",
              "options": "Value"
            },
            "properties": [
              {
                "id": "custom.cellOptions",
                "value": {
                  "mode": "gradient",
                  "type": "gauge"
                }
              },
              {
                "id": "displayName",
                "value": "Events"
              }
            ]
          }
        ]
      },
      "gridPos": {
        "h": 10,
        "w": 10,
        "x": 0,
        "y": 1
      },
      "id": 101,
      "options": {
        "cellHeight": "sm",
        "footer": {
          "countRows": false,
          "fields": "",
          "reducer": [
            "sum"
          ],
          "show": false
        },
        "showHeader": true,
        "sortBy": [
          {
            "desc": true,
            "displayName": "Events"
          }
        ]
      },
      "pluginVersion": "10.4.0",
      "targets": [
        {
          "datasource": {
            "type": "loki",
            "uid": "${DS_LOKI}"
          },
          "editorMode": "code",
          "expr": "sum by (system, subsystem) (count_over_time({service_name=~\"$service\", deployment_environment=\"$env\"} | json | system!=\"\" [$__range]))",
          "instant": true,
          "legendFormat": "{{system}}/{{subsystem}}",
          "queryType": "instant",
          "refId": "A"
        }
      ],
      "title": "Subsystem inventory",
      "transformations": [
        {
          "id": "organize",
          "options": {
            "excludeByName": {
              "Time": true
            },
            "indexByName": {
              "system": 0,
              "subsystem": 1,
              "Value": 2
            },
            "renameByName": {}
          }
        }
      ],
      "type": "table"
    },
    {
      "datasource": {
        "type": "loki",
        "uid": "${DS_LOKI}"
      },
      "description": "Total log rate aggregated by system (sums across subsystems).",
      "fieldConfig": {
        "defaults": {
          "color": {
            "mode": "palette-classic"
          },
          "custom": {
            "axisBorderShow": false,
            "axisCenteredZero": false,
            "axisColorMode": "text",
            "axisLabel": "",
            "axisPlacement": "auto",
            "barAlignment": 0,
            "drawStyle": "line",
            "fillOpacity": 10,
            "gradientMode": "none",
            "hideFrom": {
              "legend": false,
              "tooltip": false,
              "viz": false
            },
            "insertNulls": false,
            "lineInterpolation": "linear",
            "lineWidth": 1,
            "pointSize": 5,
            "scaleDistribution": {
              "type": "linear"
            },
            "showPoints": "never",
            "spanNulls": false,
            "stacking": {
              "group": "A",
              "mode": "normal"
            },
            "thresholdsStyle": {
              "mode": "off"
            }
          },
          "mappings": [],
          "thresholds": {
            "mode": "absolute",
            "steps": [
              {
                "color": "green",
                "value": null
              }
            ]
          },
          "unit": "logs/s"
        },
        "overrides": []
      },
      "gridPos": {
        "h": 5,
        "w": 14,
        "x": 10,
        "y": 1
      },
      "id": 102,
      "options": {
        "legend": {
          "calcs": [
            "lastNotNull",
            "max"
          ],
          "displayMode": "table",
          "placement": "right",
          "showLegend": true
        },
        "tooltip": {
          "mode": "multi",
          "sort": "desc"
        }
      },
      "pluginVersion": "10.4.0",
      "targets": [
        {
          "datasource": {
            "type": "loki",
            "uid": "${DS_LOKI}"
          },
          "editorMode": "code",
          "expr": "sum by (system) (rate({service_name=~\"$service\", deployment_environment=\"$env\"} | json | system=~\"$system\" [$__interval]))",
          "legendFormat": "{{system}}",
          "queryType": "range",
          "refId": "A"
        }
      ],
      "title": "Log rate by system",
      "type": "timeseries"
    },
    {
      "datasource": {
        "type": "loki",
        "uid": "${DS_LOKI}"
      },
      "description": "Warn + error rate aggregated by system. First place to look during an incident.",
      "fieldConfig": {
        "defaults": {
          "color": {
            "mode": "palette-classic"
          },
          "custom": {
            "axisBorderShow": false,
            "axisCenteredZero": false,
            "axisColorMode": "text",
            "axisLabel": "",
            "axisPlacement": "auto",
            "barAlignment": 0,
            "drawStyle": "bars",
            "fillOpacity": 70,
            "gradientMode": "none",
            "hideFrom": {
              "legend": false,
              "tooltip": false,
              "viz": false
            },
            "insertNulls": false,
            "lineInterpolation": "linear",
            "lineWidth": 1,
            "pointSize": 5,
            "scaleDistribution": {
              "type": "linear"
            },
            "showPoints": "never",
            "spanNulls": false,
            "stacking": {
              "group": "A",
              "mode": "normal"
            },
            "thresholdsStyle": {
              "mode": "off"
            }
          },
          "mappings": [],
          "thresholds": {
            "mode": "absolute",
            "steps": [
              {
                "color": "green",
                "value": null
              },
              {
                "color": "red",
                "value": 0.001
              }
            ]
          },
          "unit": "logs/s"
        },
        "overrides": []
      },
      "gridPos": {
        "h": 5,
        "w": 14,
        "x": 10,
        "y": 6
      },
      "id": 103,
      "options": {
        "legend": {
          "calcs": [
            "lastNotNull",
            "max"
          ],
          "displayMode": "table",
          "placement": "right",
          "showLegend": true
        },
        "tooltip": {
          "mode": "multi",
          "sort": "desc"
        }
      },
      "pluginVersion": "10.4.0",
      "targets": [
        {
          "datasource": {
            "type": "loki",
            "uid": "${DS_LOKI}"
          },
          "editorMode": "code",
          "expr": "sum by (system) (rate({service_name=~\"$service\", deployment_environment=\"$env\"} | json | system=~\"$system\" | level=~\"warning|error\" [$__interval]))",
          "legendFormat": "{{system}}",
          "queryType": "range",
          "refId": "A"
        }
      ],
      "title": "Warn + error rate by system",
      "type": "timeseries"
    },
    {
      "collapsed": false,
      "gridPos": {
        "h": 1,
        "w": 24,
        "x": 0,
        "y": 11
      },
      "id": 200,
      "panels": [],
      "repeat": "system",
      "repeatDirection": "v",
      "title": "system: $system",
      "type": "row"
    },
    {
      "datasource": {